Question,Attack Type,Question Context,SQL Context,Answer Field,Answer,Total Rows
Find all rows that show signs of SSH-Patator,SSH-Patator,"An SSH Patator attack is essentially an automated brute-force password-guessing campaign against an SSH service, usually carried out with the “patator” tool, which rapidly cycles through huge lists of usernames and passwords to find a working login and gain unauthorized shell access. In logs and network traffic, common signs include a very high volume of SSH connection attempts in a short period of time, many repeated “failed password” or “invalid user” entries (often across many different usernames, including obvious ones like root, admin, or test), connections from a single suspicious IP (or a small set of IPs) hitting port 22 nonstop, and sometimes attempts that follow a very regular, scripted pattern (e.g., evenly spaced attempts, alphabetically or numerically ordered username lists). On the host, you might also see increased CPU load from the SSH daemon, spikes in authentication-related log entries (/var/log/auth.log, secure, etc.), and—if the attack succeeds—a sudden valid login from an unusual IP followed by new processes being started or changes to user accounts or SSH keys.","CREATE TABLE ids2017 (""Flow ID"" VARCHAR, ""Source IP"" VARCHAR, ""Source Port"" BIGINT, ""Destination IP"" VARCHAR, ""Destination Port"" BIGINT, Protocol BIGINT, Timestamp VARCHAR, ""Flow Duration"" BIGINT, ""Total Fwd Packets"" BIGINT, ""Total Backward Packets"" BIGINT, ""Total Length of Fwd Packets"" BIGINT, ""Total Length of Bwd Packets"" BIGINT, ""Fwd Packet Length Max"" BIGINT, ""Fwd Packet Length Min"" BIGINT, ""Fwd Packet Length Mean"" DOUBLE, ""Fwd Packet Length Std"" DOUBLE, ""Bwd Packet Length Max"" BIGINT, ""Bwd Packet Length Min"" BIGINT, ""Bwd Packet Length Mean"" DOUBLE, ""Bwd Packet Length Std"" DOUBLE, ""Flow Bytes/s"" DOUBLE, ""Flow Packets/s"" DOUBLE, ""Flow IAT Mean"" DOUBLE, ""Flow IAT Std"" DOUBLE, ""Flow IAT Max"" BIGINT, ""Flow IAT Min"" BIGINT, ""Fwd IAT Total"" BIGINT, ""Fwd IAT Mean"" DOUBLE, ""Fwd IAT Std"" DOUBLE, ""Fwd IAT Max"" BIGINT, ""Fwd IAT Min"" BIGINT, ""Bwd IAT Total"" BIGINT, ""Bwd IAT Mean"" DOUBLE, ""Bwd IAT Std"" DOUBLE, ""Bwd IAT Max"" BIGINT, ""Bwd IAT Min"" BIGINT, ""Fwd PSH Flags"" BIGINT, ""Bwd PSH Flags"" BIGINT, ""Fwd URG Flags"" BIGINT, ""Bwd URG Flags"" BIGINT, ""Fwd Header Length"" BIGINT, ""Bwd Header Length"" BIGINT, ""Fwd Packets/s"" DOUBLE, ""Bwd Packets/s"" DOUBLE, ""Min Packet Length"" BIGINT, ""Max Packet Length"" BIGINT, ""Packet Length Mean"" DOUBLE, ""Packet Length Std"" DOUBLE, ""Packet Length Variance"" DOUBLE, ""FIN Flag Count"" BIGINT, ""SYN Flag Count"" BIGINT, ""RST Flag Count"" BIGINT, ""PSH Flag Count"" BIGINT, ""ACK Flag Count"" BIGINT, ""URG Flag Count"" BIGINT, ""CWE Flag Count"" BIGINT, ""ECE Flag Count"" BIGINT, ""Down/Up Ratio"" BIGINT, ""Average Packet"" Size DOUBLE, ""Avg Fwd Segment Size"" DOUBLE, ""Avg Bwd Segment Size"" DOUBLE, ""Fwd Header Length_1"" BIGINT, ""Fwd Avg Bytes/Bulk"" BIGINT, ""Fwd Avg Packets/Bulk"" BIGINT, ""Fwd Avg Bulk Rate"" BIGINT, ""Bwd Avg Bytes/Bulk"" BIGINT, ""Bwd Avg Packets/Bulk"" BIGINT, ""Bwd Avg Bulk Rate"" BIGINT, ""Subflow Fwd Packets"" BIGINT, ""Subflow Fwd Bytes"" BIGINT, ""Subflow Bwd Packets"" BIGINT, ""Subflow Bwd Bytes"" BIGINT, Init_Win_bytes_forward BIGINT, Init_Win_bytes_backward BIGINT, act_data_pkt_fwd BIGINT, min_seg_size_forward BIGINT, ""Active Mean"" DOUBLE, ""Active Std"" DOUBLE, ""Active Max"" BIGINT, ""Active Min"" BIGINT, ""Idle Mean"" DOUBLE, ""Idle Std"" DOUBLE, ""Idle Max"" BIGINT, ""Idle Min"" BIGINT)",label,5897,3117165
Find all rows that show signs of DoS slowloris,DoS slowloris,"A DoS Slowloris attack is a low-and-slow denial-of-service technique that targets web servers (especially older Apache-style servers) by opening a large number of HTTP connections and then keeping them “alive” as long as possible by sending tiny, incomplete HTTP headers at very slow intervals. Instead of flooding bandwidth, Slowloris exhausts the server’s pool of connection slots so that legitimate users can’t establish new connections, effectively taking the site offline while using relatively little attacker bandwidth. Common signs of a Slowloris attack include a huge number of open, half-finished HTTP connections from one or a few IP addresses, many requests that never complete (no full headers or body), server error logs showing timeouts or “too many open connections,” and symptoms where the server becomes unresponsive to new clients even though CPU and network usage don’t look like a classic high-volume flood.","CREATE TABLE ids2017 (""Flow ID"" VARCHAR, ""Source IP"" VARCHAR, ""Source Port"" BIGINT, ""Destination IP"" VARCHAR, ""Destination Port"" BIGINT, Protocol BIGINT, Timestamp VARCHAR, ""Flow Duration"" BIGINT, ""Total Fwd Packets"" BIGINT, ""Total Backward Packets"" BIGINT, ""Total Length of Fwd Packets"" BIGINT, ""Total Length of Bwd Packets"" BIGINT, ""Fwd Packet Length Max"" BIGINT, ""Fwd Packet Length Min"" BIGINT, ""Fwd Packet Length Mean"" DOUBLE, ""Fwd Packet Length Std"" DOUBLE, ""Bwd Packet Length Max"" BIGINT, ""Bwd Packet Length Min"" BIGINT, ""Bwd Packet Length Mean"" DOUBLE, ""Bwd Packet Length Std"" DOUBLE, ""Flow Bytes/s"" DOUBLE, ""Flow Packets/s"" DOUBLE, ""Flow IAT Mean"" DOUBLE, ""Flow IAT Std"" DOUBLE, ""Flow IAT Max"" BIGINT, ""Flow IAT Min"" BIGINT, ""Fwd IAT Total"" BIGINT, ""Fwd IAT Mean"" DOUBLE, ""Fwd IAT Std"" DOUBLE, ""Fwd IAT Max"" BIGINT, ""Fwd IAT Min"" BIGINT, ""Bwd IAT Total"" BIGINT, ""Bwd IAT Mean"" DOUBLE, ""Bwd IAT Std"" DOUBLE, ""Bwd IAT Max"" BIGINT, ""Bwd IAT Min"" BIGINT, ""Fwd PSH Flags"" BIGINT, ""Bwd PSH Flags"" BIGINT, ""Fwd URG Flags"" BIGINT, ""Bwd URG Flags"" BIGINT, ""Fwd Header Length"" BIGINT, ""Bwd Header Length"" BIGINT, ""Fwd Packets/s"" DOUBLE, ""Bwd Packets/s"" DOUBLE, ""Min Packet Length"" BIGINT, ""Max Packet Length"" BIGINT, ""Packet Length Mean"" DOUBLE, ""Packet Length Std"" DOUBLE, ""Packet Length Variance"" DOUBLE, ""FIN Flag Count"" BIGINT, ""SYN Flag Count"" BIGINT, ""RST Flag Count"" BIGINT, ""PSH Flag Count"" BIGINT, ""ACK Flag Count"" BIGINT, ""URG Flag Count"" BIGINT, ""CWE Flag Count"" BIGINT, ""ECE Flag Count"" BIGINT, ""Down/Up Ratio"" BIGINT, ""Average Packet"" Size DOUBLE, ""Avg Fwd Segment Size"" DOUBLE, ""Avg Bwd Segment Size"" DOUBLE, ""Fwd Header Length_1"" BIGINT, ""Fwd Avg Bytes/Bulk"" BIGINT, ""Fwd Avg Packets/Bulk"" BIGINT, ""Fwd Avg Bulk Rate"" BIGINT, ""Bwd Avg Bytes/Bulk"" BIGINT, ""Bwd Avg Packets/Bulk"" BIGINT, ""Bwd Avg Bulk Rate"" BIGINT, ""Subflow Fwd Packets"" BIGINT, ""Subflow Fwd Bytes"" BIGINT, ""Subflow Bwd Packets"" BIGINT, ""Subflow Bwd Bytes"" BIGINT, Init_Win_bytes_forward BIGINT, Init_Win_bytes_backward BIGINT, act_data_pkt_fwd BIGINT, min_seg_size_forward BIGINT, ""Active Mean"" DOUBLE, ""Active Std"" DOUBLE, ""Active Max"" BIGINT, ""Active Min"" BIGINT, ""Idle Mean"" DOUBLE, ""Idle Std"" DOUBLE, ""Idle Max"" BIGINT, ""Idle Min"" BIGINT)",label,5796,3117165
Find all rows that show signs of Bot,Bot,"A botnet attack is when an attacker controls a large network of compromised devices (bots)—like infected PCs, servers, or even IoT gadgets—and uses them together to carry out malicious actions, such as DDoS attacks, credential stuffing, spam campaigns, or large-scale scanning, often without the owners’ knowledge. Instead of one machine attacking you, it’s hundreds or thousands acting in coordination. Common signs of a botnet attack include sudden spikes in incoming traffic from many different IP addresses (often globally distributed), unusual patterns like identical requests from many sources, services becoming slow or unavailable without a clear legitimate traffic spike, outbound connections from your own hosts to strange domains or IPs (command-and-control servers), unexpected increases in bandwidth or CPU usage on endpoints, and security tools flagging connections or behavior that match known botnet infrastructure or malware signatures.","CREATE TABLE ids2017 (""Flow ID"" VARCHAR, ""Source IP"" VARCHAR, ""Source Port"" BIGINT, ""Destination IP"" VARCHAR, ""Destination Port"" BIGINT, Protocol BIGINT, Timestamp VARCHAR, ""Flow Duration"" BIGINT, ""Total Fwd Packets"" BIGINT, ""Total Backward Packets"" BIGINT, ""Total Length of Fwd Packets"" BIGINT, ""Total Length of Bwd Packets"" BIGINT, ""Fwd Packet Length Max"" BIGINT, ""Fwd Packet Length Min"" BIGINT, ""Fwd Packet Length Mean"" DOUBLE, ""Fwd Packet Length Std"" DOUBLE, ""Bwd Packet Length Max"" BIGINT, ""Bwd Packet Length Min"" BIGINT, ""Bwd Packet Length Mean"" DOUBLE, ""Bwd Packet Length Std"" DOUBLE, ""Flow Bytes/s"" DOUBLE, ""Flow Packets/s"" DOUBLE, ""Flow IAT Mean"" DOUBLE, ""Flow IAT Std"" DOUBLE, ""Flow IAT Max"" BIGINT, ""Flow IAT Min"" BIGINT, ""Fwd IAT Total"" BIGINT, ""Fwd IAT Mean"" DOUBLE, ""Fwd IAT Std"" DOUBLE, ""Fwd IAT Max"" BIGINT, ""Fwd IAT Min"" BIGINT, ""Bwd IAT Total"" BIGINT, ""Bwd IAT Mean"" DOUBLE, ""Bwd IAT Std"" DOUBLE, ""Bwd IAT Max"" BIGINT, ""Bwd IAT Min"" BIGINT, ""Fwd PSH Flags"" BIGINT, ""Bwd PSH Flags"" BIGINT, ""Fwd URG Flags"" BIGINT, ""Bwd URG Flags"" BIGINT, ""Fwd Header Length"" BIGINT, ""Bwd Header Length"" BIGINT, ""Fwd Packets/s"" DOUBLE, ""Bwd Packets/s"" DOUBLE, ""Min Packet Length"" BIGINT, ""Max Packet Length"" BIGINT, ""Packet Length Mean"" DOUBLE, ""Packet Length Std"" DOUBLE, ""Packet Length Variance"" DOUBLE, ""FIN Flag Count"" BIGINT, ""SYN Flag Count"" BIGINT, ""RST Flag Count"" BIGINT, ""PSH Flag Count"" BIGINT, ""ACK Flag Count"" BIGINT, ""URG Flag Count"" BIGINT, ""CWE Flag Count"" BIGINT, ""ECE Flag Count"" BIGINT, ""Down/Up Ratio"" BIGINT, ""Average Packet"" Size DOUBLE, ""Avg Fwd Segment Size"" DOUBLE, ""Avg Bwd Segment Size"" DOUBLE, ""Fwd Header Length_1"" BIGINT, ""Fwd Avg Bytes/Bulk"" BIGINT, ""Fwd Avg Packets/Bulk"" BIGINT, ""Fwd Avg Bulk Rate"" BIGINT, ""Bwd Avg Bytes/Bulk"" BIGINT, ""Bwd Avg Packets/Bulk"" BIGINT, ""Bwd Avg Bulk Rate"" BIGINT, ""Subflow Fwd Packets"" BIGINT, ""Subflow Fwd Bytes"" BIGINT, ""Subflow Bwd Packets"" BIGINT, ""Subflow Bwd Bytes"" BIGINT, Init_Win_bytes_forward BIGINT, Init_Win_bytes_backward BIGINT, act_data_pkt_fwd BIGINT, min_seg_size_forward BIGINT, ""Active Mean"" DOUBLE, ""Active Std"" DOUBLE, ""Active Max"" BIGINT, ""Active Min"" BIGINT, ""Idle Mean"" DOUBLE, ""Idle Std"" DOUBLE, ""Idle Max"" BIGINT, ""Idle Min"" BIGINT)",label,1966,3117165
Find all rows that show signs of FTP-Patator,FTP-Patator,"An FTP Patator attack is an automated brute-force attack against an FTP server, typically carried out using the “patator” tool, which rapidly cycles through many username–password combinations to find valid credentials and gain unauthorized access to files. Instead of a few mistaken logins, Patator hammers the FTP service with systematic, script-driven attempts. Common signs include a high volume of failed login attempts in a short time window, many 530 Login incorrect or similar errors in FTP logs, repeated attempts against common usernames like ftp, admin, user, or random-looking usernames, and a large number of connection attempts to port 21 from a single IP or a small set of IPs. You might also see evenly spaced or very regular login attempts (indicating automation), increased load on the FTP service, and—if the attack succeeds—suspicious successful logins followed by unusual file listing, upload, download, or deletion activity.","CREATE TABLE ids2017 (""Flow ID"" VARCHAR, ""Source IP"" VARCHAR, ""Source Port"" BIGINT, ""Destination IP"" VARCHAR, ""Destination Port"" BIGINT, Protocol BIGINT, Timestamp VARCHAR, ""Flow Duration"" BIGINT, ""Total Fwd Packets"" BIGINT, ""Total Backward Packets"" BIGINT, ""Total Length of Fwd Packets"" BIGINT, ""Total Length of Bwd Packets"" BIGINT, ""Fwd Packet Length Max"" BIGINT, ""Fwd Packet Length Min"" BIGINT, ""Fwd Packet Length Mean"" DOUBLE, ""Fwd Packet Length Std"" DOUBLE, ""Bwd Packet Length Max"" BIGINT, ""Bwd Packet Length Min"" BIGINT, ""Bwd Packet Length Mean"" DOUBLE, ""Bwd Packet Length Std"" DOUBLE, ""Flow Bytes/s"" DOUBLE, ""Flow Packets/s"" DOUBLE, ""Flow IAT Mean"" DOUBLE, ""Flow IAT Std"" DOUBLE, ""Flow IAT Max"" BIGINT, ""Flow IAT Min"" BIGINT, ""Fwd IAT Total"" BIGINT, ""Fwd IAT Mean"" DOUBLE, ""Fwd IAT Std"" DOUBLE, ""Fwd IAT Max"" BIGINT, ""Fwd IAT Min"" BIGINT, ""Bwd IAT Total"" BIGINT, ""Bwd IAT Mean"" DOUBLE, ""Bwd IAT Std"" DOUBLE, ""Bwd IAT Max"" BIGINT, ""Bwd IAT Min"" BIGINT, ""Fwd PSH Flags"" BIGINT, ""Bwd PSH Flags"" BIGINT, ""Fwd URG Flags"" BIGINT, ""Bwd URG Flags"" BIGINT, ""Fwd Header Length"" BIGINT, ""Bwd Header Length"" BIGINT, ""Fwd Packets/s"" DOUBLE, ""Bwd Packets/s"" DOUBLE, ""Min Packet Length"" BIGINT, ""Max Packet Length"" BIGINT, ""Packet Length Mean"" DOUBLE, ""Packet Length Std"" DOUBLE, ""Packet Length Variance"" DOUBLE, ""FIN Flag Count"" BIGINT, ""SYN Flag Count"" BIGINT, ""RST Flag Count"" BIGINT, ""PSH Flag Count"" BIGINT, ""ACK Flag Count"" BIGINT, ""URG Flag Count"" BIGINT, ""CWE Flag Count"" BIGINT, ""ECE Flag Count"" BIGINT, ""Down/Up Ratio"" BIGINT, ""Average Packet"" Size DOUBLE, ""Avg Fwd Segment Size"" DOUBLE, ""Avg Bwd Segment Size"" DOUBLE, ""Fwd Header Length_1"" BIGINT, ""Fwd Avg Bytes/Bulk"" BIGINT, ""Fwd Avg Packets/Bulk"" BIGINT, ""Fwd Avg Bulk Rate"" BIGINT, ""Bwd Avg Bytes/Bulk"" BIGINT, ""Bwd Avg Packets/Bulk"" BIGINT, ""Bwd Avg Bulk Rate"" BIGINT, ""Subflow Fwd Packets"" BIGINT, ""Subflow Fwd Bytes"" BIGINT, ""Subflow Bwd Packets"" BIGINT, ""Subflow Bwd Bytes"" BIGINT, Init_Win_bytes_forward BIGINT, Init_Win_bytes_backward BIGINT, act_data_pkt_fwd BIGINT, min_seg_size_forward BIGINT, ""Active Mean"" DOUBLE, ""Active Std"" DOUBLE, ""Active Max"" BIGINT, ""Active Min"" BIGINT, ""Idle Mean"" DOUBLE, ""Idle Std"" DOUBLE, ""Idle Max"" BIGINT, ""Idle Min"" BIGINT)",label,7938,3117165
Find all rows that show signs of DoS Slowhttptest,DoS Slowhttptest,"A DoS Slowhttptest attack is a “slow HTTP” denial-of-service attack (often generated with the slowhttptest tool) that targets web servers by opening many HTTP connections and then sending the request data extremely slowly, so each connection stays open and ties up server resources without needing much bandwidth from the attacker. Instead of blasting traffic, it exhausts the server’s concurrent connection or thread pool, preventing it from handling real users. Common signs of a Slowhttptest-style attack include a very high number of active HTTP connections in a “reading request” or “waiting for body” state, many requests that never complete or take an abnormally long time to finish, lots of partial or incomplete HTTP headers or bodies in logs, clients that send data at very low, consistent rates, and a web server that becomes sluggish or stops responding to new connections even though CPU and overall bandwidth usage may look relatively normal compared to classic volumetric DoS attacks.","CREATE TABLE ids2017 (""Flow ID"" VARCHAR, ""Source IP"" VARCHAR, ""Source Port"" BIGINT, ""Destination IP"" VARCHAR, ""Destination Port"" BIGINT, Protocol BIGINT, Timestamp VARCHAR, ""Flow Duration"" BIGINT, ""Total Fwd Packets"" BIGINT, ""Total Backward Packets"" BIGINT, ""Total Length of Fwd Packets"" BIGINT, ""Total Length of Bwd Packets"" BIGINT, ""Fwd Packet Length Max"" BIGINT, ""Fwd Packet Length Min"" BIGINT, ""Fwd Packet Length Mean"" DOUBLE, ""Fwd Packet Length Std"" DOUBLE, ""Bwd Packet Length Max"" BIGINT, ""Bwd Packet Length Min"" BIGINT, ""Bwd Packet Length Mean"" DOUBLE, ""Bwd Packet Length Std"" DOUBLE, ""Flow Bytes/s"" DOUBLE, ""Flow Packets/s"" DOUBLE, ""Flow IAT Mean"" DOUBLE, ""Flow IAT Std"" DOUBLE, ""Flow IAT Max"" BIGINT, ""Flow IAT Min"" BIGINT, ""Fwd IAT Total"" BIGINT, ""Fwd IAT Mean"" DOUBLE, ""Fwd IAT Std"" DOUBLE, ""Fwd IAT Max"" BIGINT, ""Fwd IAT Min"" BIGINT, ""Bwd IAT Total"" BIGINT, ""Bwd IAT Mean"" DOUBLE, ""Bwd IAT Std"" DOUBLE, ""Bwd IAT Max"" BIGINT, ""Bwd IAT Min"" BIGINT, ""Fwd PSH Flags"" BIGINT, ""Bwd PSH Flags"" BIGINT, ""Fwd URG Flags"" BIGINT, ""Bwd URG Flags"" BIGINT, ""Fwd Header Length"" BIGINT, ""Bwd Header Length"" BIGINT, ""Fwd Packets/s"" DOUBLE, ""Bwd Packets/s"" DOUBLE, ""Min Packet Length"" BIGINT, ""Max Packet Length"" BIGINT, ""Packet Length Mean"" DOUBLE, ""Packet Length Std"" DOUBLE, ""Packet Length Variance"" DOUBLE, ""FIN Flag Count"" BIGINT, ""SYN Flag Count"" BIGINT, ""RST Flag Count"" BIGINT, ""PSH Flag Count"" BIGINT, ""ACK Flag Count"" BIGINT, ""URG Flag Count"" BIGINT, ""CWE Flag Count"" BIGINT, ""ECE Flag Count"" BIGINT, ""Down/Up Ratio"" BIGINT, ""Average Packet"" Size DOUBLE, ""Avg Fwd Segment Size"" DOUBLE, ""Avg Bwd Segment Size"" DOUBLE, ""Fwd Header Length_1"" BIGINT, ""Fwd Avg Bytes/Bulk"" BIGINT, ""Fwd Avg Packets/Bulk"" BIGINT, ""Fwd Avg Bulk Rate"" BIGINT, ""Bwd Avg Bytes/Bulk"" BIGINT, ""Bwd Avg Packets/Bulk"" BIGINT, ""Bwd Avg Bulk Rate"" BIGINT, ""Subflow Fwd Packets"" BIGINT, ""Subflow Fwd Bytes"" BIGINT, ""Subflow Bwd Packets"" BIGINT, ""Subflow Bwd Bytes"" BIGINT, Init_Win_bytes_forward BIGINT, Init_Win_bytes_backward BIGINT, act_data_pkt_fwd BIGINT, min_seg_size_forward BIGINT, ""Active Mean"" DOUBLE, ""Active Std"" DOUBLE, ""Active Max"" BIGINT, ""Active Min"" BIGINT, ""Idle Mean"" DOUBLE, ""Idle Std"" DOUBLE, ""Idle Max"" BIGINT, ""Idle Min"" BIGINT)",label,5499,3117165
Find all rows that show signs of Infiltration,Infiltration,"A network infiltration attack is when an attacker quietly slips into an organization’s internal network—often by exploiting a vulnerability, stealing credentials, or tricking a user with phishing—and then moves around inside to spy, steal data, or position themselves for a bigger attack, all while trying not to be detected. Instead of crashing systems, the goal is long-term, stealthy access. Common signs include unusual login activity (logins at odd hours, from unfamiliar locations, or repeated failed logins), unexpected new user accounts or changes to existing permissions, strange processes or services running on endpoints or servers, devices making outbound connections to suspicious or unknown domains/IPs (possible command-and-control), unexplained spikes in internal traffic or large data transfers leaving the network, disabled or tampered security tools and logs, and lateral movement patterns such as many internal connections to file servers, domain controllers, or other high-value systems that don’t match a user’s normal behavior.","CREATE TABLE ids2017 (""Flow ID"" VARCHAR, ""Source IP"" VARCHAR, ""Source Port"" BIGINT, ""Destination IP"" VARCHAR, ""Destination Port"" BIGINT, Protocol BIGINT, Timestamp VARCHAR, ""Flow Duration"" BIGINT, ""Total Fwd Packets"" BIGINT, ""Total Backward Packets"" BIGINT, ""Total Length of Fwd Packets"" BIGINT, ""Total Length of Bwd Packets"" BIGINT, ""Fwd Packet Length Max"" BIGINT, ""Fwd Packet Length Min"" BIGINT, ""Fwd Packet Length Mean"" DOUBLE, ""Fwd Packet Length Std"" DOUBLE, ""Bwd Packet Length Max"" BIGINT, ""Bwd Packet Length Min"" BIGINT, ""Bwd Packet Length Mean"" DOUBLE, ""Bwd Packet Length Std"" DOUBLE, ""Flow Bytes/s"" DOUBLE, ""Flow Packets/s"" DOUBLE, ""Flow IAT Mean"" DOUBLE, ""Flow IAT Std"" DOUBLE, ""Flow IAT Max"" BIGINT, ""Flow IAT Min"" BIGINT, ""Fwd IAT Total"" BIGINT, ""Fwd IAT Mean"" DOUBLE, ""Fwd IAT Std"" DOUBLE, ""Fwd IAT Max"" BIGINT, ""Fwd IAT Min"" BIGINT, ""Bwd IAT Total"" BIGINT, ""Bwd IAT Mean"" DOUBLE, ""Bwd IAT Std"" DOUBLE, ""Bwd IAT Max"" BIGINT, ""Bwd IAT Min"" BIGINT, ""Fwd PSH Flags"" BIGINT, ""Bwd PSH Flags"" BIGINT, ""Fwd URG Flags"" BIGINT, ""Bwd URG Flags"" BIGINT, ""Fwd Header Length"" BIGINT, ""Bwd Header Length"" BIGINT, ""Fwd Packets/s"" DOUBLE, ""Bwd Packets/s"" DOUBLE, ""Min Packet Length"" BIGINT, ""Max Packet Length"" BIGINT, ""Packet Length Mean"" DOUBLE, ""Packet Length Std"" DOUBLE, ""Packet Length Variance"" DOUBLE, ""FIN Flag Count"" BIGINT, ""SYN Flag Count"" BIGINT, ""RST Flag Count"" BIGINT, ""PSH Flag Count"" BIGINT, ""ACK Flag Count"" BIGINT, ""URG Flag Count"" BIGINT, ""CWE Flag Count"" BIGINT, ""ECE Flag Count"" BIGINT, ""Down/Up Ratio"" BIGINT, ""Average Packet"" Size DOUBLE, ""Avg Fwd Segment Size"" DOUBLE, ""Avg Bwd Segment Size"" DOUBLE, ""Fwd Header Length_1"" BIGINT, ""Fwd Avg Bytes/Bulk"" BIGINT, ""Fwd Avg Packets/Bulk"" BIGINT, ""Fwd Avg Bulk Rate"" BIGINT, ""Bwd Avg Bytes/Bulk"" BIGINT, ""Bwd Avg Packets/Bulk"" BIGINT, ""Bwd Avg Bulk Rate"" BIGINT, ""Subflow Fwd Packets"" BIGINT, ""Subflow Fwd Bytes"" BIGINT, ""Subflow Bwd Packets"" BIGINT, ""Subflow Bwd Bytes"" BIGINT, Init_Win_bytes_forward BIGINT, Init_Win_bytes_backward BIGINT, act_data_pkt_fwd BIGINT, min_seg_size_forward BIGINT, ""Active Mean"" DOUBLE, ""Active Std"" DOUBLE, ""Active Max"" BIGINT, ""Active Min"" BIGINT, ""Idle Mean"" DOUBLE, ""Idle Std"" DOUBLE, ""Idle Max"" BIGINT, ""Idle Min"" BIGINT)",label,36,3117165
Find all rows that show signs of DoS GoldenEye,DoS GoldenEye,"A DoS GoldenEye attack is an application-layer denial-of-service attack generated with the “GoldenEye” tool, which aggressively floods a web server with HTTP requests (usually GET/POST) while abusing features like keep-alive, randomized headers, and concurrent threads to exhaust the server’s connection and worker pools. Instead of just saturating raw bandwidth, GoldenEye aims to tie up the web server itself so it can’t respond to legitimate users. Common signs include a sudden spike in HTTP traffic to ports 80/443 from one or a small set of IPs, large numbers of simultaneous connections in states like “reading” or “waiting,” many repeated requests to the same URLs with varied User-Agents or referrers, web server logs full of similar requests at very high frequency, increasing response times and 5xx errors (e.g., 503 Service Unavailable), and high CPU or thread usage on the web server even though overall network bandwidth may not look like a typical volumetric DDoS flood.","CREATE TABLE ids2017 (""Flow ID"" VARCHAR, ""Source IP"" VARCHAR, ""Source Port"" BIGINT, ""Destination IP"" VARCHAR, ""Destination Port"" BIGINT, Protocol BIGINT, Timestamp VARCHAR, ""Flow Duration"" BIGINT, ""Total Fwd Packets"" BIGINT, ""Total Backward Packets"" BIGINT, ""Total Length of Fwd Packets"" BIGINT, ""Total Length of Bwd Packets"" BIGINT, ""Fwd Packet Length Max"" BIGINT, ""Fwd Packet Length Min"" BIGINT, ""Fwd Packet Length Mean"" DOUBLE, ""Fwd Packet Length Std"" DOUBLE, ""Bwd Packet Length Max"" BIGINT, ""Bwd Packet Length Min"" BIGINT, ""Bwd Packet Length Mean"" DOUBLE, ""Bwd Packet Length Std"" DOUBLE, ""Flow Bytes/s"" DOUBLE, ""Flow Packets/s"" DOUBLE, ""Flow IAT Mean"" DOUBLE, ""Flow IAT Std"" DOUBLE, ""Flow IAT Max"" BIGINT, ""Flow IAT Min"" BIGINT, ""Fwd IAT Total"" BIGINT, ""Fwd IAT Mean"" DOUBLE, ""Fwd IAT Std"" DOUBLE, ""Fwd IAT Max"" BIGINT, ""Fwd IAT Min"" BIGINT, ""Bwd IAT Total"" BIGINT, ""Bwd IAT Mean"" DOUBLE, ""Bwd IAT Std"" DOUBLE, ""Bwd IAT Max"" BIGINT, ""Bwd IAT Min"" BIGINT, ""Fwd PSH Flags"" BIGINT, ""Bwd PSH Flags"" BIGINT, ""Fwd URG Flags"" BIGINT, ""Bwd URG Flags"" BIGINT, ""Fwd Header Length"" BIGINT, ""Bwd Header Length"" BIGINT, ""Fwd Packets/s"" DOUBLE, ""Bwd Packets/s"" DOUBLE, ""Min Packet Length"" BIGINT, ""Max Packet Length"" BIGINT, ""Packet Length Mean"" DOUBLE, ""Packet Length Std"" DOUBLE, ""Packet Length Variance"" DOUBLE, ""FIN Flag Count"" BIGINT, ""SYN Flag Count"" BIGINT, ""RST Flag Count"" BIGINT, ""PSH Flag Count"" BIGINT, ""ACK Flag Count"" BIGINT, ""URG Flag Count"" BIGINT, ""CWE Flag Count"" BIGINT, ""ECE Flag Count"" BIGINT, ""Down/Up Ratio"" BIGINT, ""Average Packet"" Size DOUBLE, ""Avg Fwd Segment Size"" DOUBLE, ""Avg Bwd Segment Size"" DOUBLE, ""Fwd Header Length_1"" BIGINT, ""Fwd Avg Bytes/Bulk"" BIGINT, ""Fwd Avg Packets/Bulk"" BIGINT, ""Fwd Avg Bulk Rate"" BIGINT, ""Bwd Avg Bytes/Bulk"" BIGINT, ""Bwd Avg Packets/Bulk"" BIGINT, ""Bwd Avg Bulk Rate"" BIGINT, ""Subflow Fwd Packets"" BIGINT, ""Subflow Fwd Bytes"" BIGINT, ""Subflow Bwd Packets"" BIGINT, ""Subflow Bwd Bytes"" BIGINT, Init_Win_bytes_forward BIGINT, Init_Win_bytes_backward BIGINT, act_data_pkt_fwd BIGINT, min_seg_size_forward BIGINT, ""Active Mean"" DOUBLE, ""Active Std"" DOUBLE, ""Active Max"" BIGINT, ""Active Min"" BIGINT, ""Idle Mean"" DOUBLE, ""Idle Std"" DOUBLE, ""Idle Max"" BIGINT, ""Idle Min"" BIGINT)",label,10293,3117165
