Question,Attack Type,Question Context,SQL Context,Answer Field,Answer,Total Rows
Find all rows that show signs of PortScan,PortScan,"A portscan attack is a reconnaissance technique where an attacker systematically probes a host or network to see which ports are open and what services are listening, so they can later target specific vulnerabilities rather than attacking blindly. Instead of trying to break in immediately, the attacker sends many connection attempts (often SYN packets) to a range of ports and observes which ones respond. Common signs of a portscan include a large number of connection attempts from a single IP (or small group of IPs) to many different ports in a short time, repeated attempts that don’t follow normal user behavior (e.g., sequential port numbers, or connections to unusual high ports), lots of half-open TCP connections (SYNs without full handshakes), and IDS/IPS alerts flagging known scan patterns such as SYN scans, FIN scans, or NULL/Xmas scans. You might also see scans focused on specific ports tied to high-value services (SSH 22, RDP 3389, databases, web admin ports, etc.), especially if those ports are not normally accessed by typical users.","CREATE TABLE ids2017 (""Flow ID"" VARCHAR, ""Source IP"" VARCHAR, ""Source Port"" BIGINT, ""Destination IP"" VARCHAR, ""Destination Port"" BIGINT, Protocol BIGINT, Timestamp VARCHAR, ""Flow Duration"" BIGINT, ""Total Fwd Packets"" BIGINT, ""Total Backward Packets"" BIGINT, ""Total Length of Fwd Packets"" BIGINT, ""Total Length of Bwd Packets"" BIGINT, ""Fwd Packet Length Max"" BIGINT, ""Fwd Packet Length Min"" BIGINT, ""Fwd Packet Length Mean"" DOUBLE, ""Fwd Packet Length Std"" DOUBLE, ""Bwd Packet Length Max"" BIGINT, ""Bwd Packet Length Min"" BIGINT, ""Bwd Packet Length Mean"" DOUBLE, ""Bwd Packet Length Std"" DOUBLE, ""Flow Bytes/s"" DOUBLE, ""Flow Packets/s"" DOUBLE, ""Flow IAT Mean"" DOUBLE, ""Flow IAT Std"" DOUBLE, ""Flow IAT Max"" BIGINT, ""Flow IAT Min"" BIGINT, ""Fwd IAT Total"" BIGINT, ""Fwd IAT Mean"" DOUBLE, ""Fwd IAT Std"" DOUBLE, ""Fwd IAT Max"" BIGINT, ""Fwd IAT Min"" BIGINT, ""Bwd IAT Total"" BIGINT, ""Bwd IAT Mean"" DOUBLE, ""Bwd IAT Std"" DOUBLE, ""Bwd IAT Max"" BIGINT, ""Bwd IAT Min"" BIGINT, ""Fwd PSH Flags"" BIGINT, ""Bwd PSH Flags"" BIGINT, ""Fwd URG Flags"" BIGINT, ""Bwd URG Flags"" BIGINT, ""Fwd Header Length"" BIGINT, ""Bwd Header Length"" BIGINT, ""Fwd Packets/s"" DOUBLE, ""Bwd Packets/s"" DOUBLE, ""Min Packet Length"" BIGINT, ""Max Packet Length"" BIGINT, ""Packet Length Mean"" DOUBLE, ""Packet Length Std"" DOUBLE, ""Packet Length Variance"" DOUBLE, ""FIN Flag Count"" BIGINT, ""SYN Flag Count"" BIGINT, ""RST Flag Count"" BIGINT, ""PSH Flag Count"" BIGINT, ""ACK Flag Count"" BIGINT, ""URG Flag Count"" BIGINT, ""CWE Flag Count"" BIGINT, ""ECE Flag Count"" BIGINT, ""Down/Up Ratio"" BIGINT, ""Average Packet"" Size DOUBLE, ""Avg Fwd Segment Size"" DOUBLE, ""Avg Bwd Segment Size"" DOUBLE, ""Fwd Header Length_1"" BIGINT, ""Fwd Avg Bytes/Bulk"" BIGINT, ""Fwd Avg Packets/Bulk"" BIGINT, ""Fwd Avg Bulk Rate"" BIGINT, ""Bwd Avg Bytes/Bulk"" BIGINT, ""Bwd Avg Packets/Bulk"" BIGINT, ""Bwd Avg Bulk Rate"" BIGINT, ""Subflow Fwd Packets"" BIGINT, ""Subflow Fwd Bytes"" BIGINT, ""Subflow Bwd Packets"" BIGINT, ""Subflow Bwd Bytes"" BIGINT, Init_Win_bytes_forward BIGINT, Init_Win_bytes_backward BIGINT, act_data_pkt_fwd BIGINT, min_seg_size_forward BIGINT, ""Active Mean"" DOUBLE, ""Active Std"" DOUBLE, ""Active Max"" BIGINT, ""Active Min"" BIGINT, ""Idle Mean"" DOUBLE, ""Idle Std"" DOUBLE, ""Idle Max"" BIGINT, ""Idle Min"" BIGINT)",label,158930,3117165
Find all rows that show signs of Heartbleed,Heartbleed,"A Heartbleed attack exploits a famous vulnerability (CVE-2014-0160) in certain versions of OpenSSL’s TLS “heartbeat” extension, where a client can claim it is sending a chunk of data of a certain length but actually send much less, and the server responds by echoing back that claimed length—pulling extra bytes straight from its own memory. This lets an attacker repeatedly siphon small chunks of RAM from a vulnerable server, potentially exposing highly sensitive data like usernames/passwords, session cookies, private keys, or other in-memory secrets without leaving obvious traces. Common signs of a Heartbleed attack are mostly visible in network and IDS logs rather than to end users: an unusual volume of TLS heartbeat requests, especially with suspicious or mismatched payload/length fields; IDS/IPS alerts for Heartbleed signatures; and, after the fact, unexplained credential compromises or certificates that appear to be stolen and abused. However, a key challenge is that Heartbleed attacks are often “quiet,” leaving little direct evidence on the host beyond this odd heartbeat traffic.","CREATE TABLE ids2017 (""Flow ID"" VARCHAR, ""Source IP"" VARCHAR, ""Source Port"" BIGINT, ""Destination IP"" VARCHAR, ""Destination Port"" BIGINT, Protocol BIGINT, Timestamp VARCHAR, ""Flow Duration"" BIGINT, ""Total Fwd Packets"" BIGINT, ""Total Backward Packets"" BIGINT, ""Total Length of Fwd Packets"" BIGINT, ""Total Length of Bwd Packets"" BIGINT, ""Fwd Packet Length Max"" BIGINT, ""Fwd Packet Length Min"" BIGINT, ""Fwd Packet Length Mean"" DOUBLE, ""Fwd Packet Length Std"" DOUBLE, ""Bwd Packet Length Max"" BIGINT, ""Bwd Packet Length Min"" BIGINT, ""Bwd Packet Length Mean"" DOUBLE, ""Bwd Packet Length Std"" DOUBLE, ""Flow Bytes/s"" DOUBLE, ""Flow Packets/s"" DOUBLE, ""Flow IAT Mean"" DOUBLE, ""Flow IAT Std"" DOUBLE, ""Flow IAT Max"" BIGINT, ""Flow IAT Min"" BIGINT, ""Fwd IAT Total"" BIGINT, ""Fwd IAT Mean"" DOUBLE, ""Fwd IAT Std"" DOUBLE, ""Fwd IAT Max"" BIGINT, ""Fwd IAT Min"" BIGINT, ""Bwd IAT Total"" BIGINT, ""Bwd IAT Mean"" DOUBLE, ""Bwd IAT Std"" DOUBLE, ""Bwd IAT Max"" BIGINT, ""Bwd IAT Min"" BIGINT, ""Fwd PSH Flags"" BIGINT, ""Bwd PSH Flags"" BIGINT, ""Fwd URG Flags"" BIGINT, ""Bwd URG Flags"" BIGINT, ""Fwd Header Length"" BIGINT, ""Bwd Header Length"" BIGINT, ""Fwd Packets/s"" DOUBLE, ""Bwd Packets/s"" DOUBLE, ""Min Packet Length"" BIGINT, ""Max Packet Length"" BIGINT, ""Packet Length Mean"" DOUBLE, ""Packet Length Std"" DOUBLE, ""Packet Length Variance"" DOUBLE, ""FIN Flag Count"" BIGINT, ""SYN Flag Count"" BIGINT, ""RST Flag Count"" BIGINT, ""PSH Flag Count"" BIGINT, ""ACK Flag Count"" BIGINT, ""URG Flag Count"" BIGINT, ""CWE Flag Count"" BIGINT, ""ECE Flag Count"" BIGINT, ""Down/Up Ratio"" BIGINT, ""Average Packet"" Size DOUBLE, ""Avg Fwd Segment Size"" DOUBLE, ""Avg Bwd Segment Size"" DOUBLE, ""Fwd Header Length_1"" BIGINT, ""Fwd Avg Bytes/Bulk"" BIGINT, ""Fwd Avg Packets/Bulk"" BIGINT, ""Fwd Avg Bulk Rate"" BIGINT, ""Bwd Avg Bytes/Bulk"" BIGINT, ""Bwd Avg Packets/Bulk"" BIGINT, ""Bwd Avg Bulk Rate"" BIGINT, ""Subflow Fwd Packets"" BIGINT, ""Subflow Fwd Bytes"" BIGINT, ""Subflow Bwd Packets"" BIGINT, ""Subflow Bwd Bytes"" BIGINT, Init_Win_bytes_forward BIGINT, Init_Win_bytes_backward BIGINT, act_data_pkt_fwd BIGINT, min_seg_size_forward BIGINT, ""Active Mean"" DOUBLE, ""Active Std"" DOUBLE, ""Active Max"" BIGINT, ""Active Min"" BIGINT, ""Idle Mean"" DOUBLE, ""Idle Std"" DOUBLE, ""Idle Max"" BIGINT, ""Idle Min"" BIGINT)",label,11,3117165
Find all rows that show signs of DDoS,DDoS,"A DDoS (Distributed Denial of Service) attack is when an attacker uses many machines at once—often a large botnet of compromised computers, servers, or IoT devices—to overwhelm a target website, server, or network so that legitimate users can’t access it. Instead of a single source flooding you, traffic comes from hundreds or thousands of IPs acting in coordination, making it harder to block with simple IP-based filters. Common signs of a DDoS attack include a sudden surge in traffic from many geographically dispersed or otherwise unrelated IP addresses, services becoming extremely slow or timing out, large spikes in bandwidth usage or in the number of concurrent connections, unusual traffic patterns (e.g., many identical requests to the same endpoint), routers or firewalls hitting connection or CPU limits, and alerts from monitoring/IDS tools about volumetric floods, protocol anomalies, or application-layer request storms that don’t match normal user behavior or expected traffic spikes.","CREATE TABLE ids2017 (""Flow ID"" VARCHAR, ""Source IP"" VARCHAR, ""Source Port"" BIGINT, ""Destination IP"" VARCHAR, ""Destination Port"" BIGINT, Protocol BIGINT, Timestamp VARCHAR, ""Flow Duration"" BIGINT, ""Total Fwd Packets"" BIGINT, ""Total Backward Packets"" BIGINT, ""Total Length of Fwd Packets"" BIGINT, ""Total Length of Bwd Packets"" BIGINT, ""Fwd Packet Length Max"" BIGINT, ""Fwd Packet Length Min"" BIGINT, ""Fwd Packet Length Mean"" DOUBLE, ""Fwd Packet Length Std"" DOUBLE, ""Bwd Packet Length Max"" BIGINT, ""Bwd Packet Length Min"" BIGINT, ""Bwd Packet Length Mean"" DOUBLE, ""Bwd Packet Length Std"" DOUBLE, ""Flow Bytes/s"" DOUBLE, ""Flow Packets/s"" DOUBLE, ""Flow IAT Mean"" DOUBLE, ""Flow IAT Std"" DOUBLE, ""Flow IAT Max"" BIGINT, ""Flow IAT Min"" BIGINT, ""Fwd IAT Total"" BIGINT, ""Fwd IAT Mean"" DOUBLE, ""Fwd IAT Std"" DOUBLE, ""Fwd IAT Max"" BIGINT, ""Fwd IAT Min"" BIGINT, ""Bwd IAT Total"" BIGINT, ""Bwd IAT Mean"" DOUBLE, ""Bwd IAT Std"" DOUBLE, ""Bwd IAT Max"" BIGINT, ""Bwd IAT Min"" BIGINT, ""Fwd PSH Flags"" BIGINT, ""Bwd PSH Flags"" BIGINT, ""Fwd URG Flags"" BIGINT, ""Bwd URG Flags"" BIGINT, ""Fwd Header Length"" BIGINT, ""Bwd Header Length"" BIGINT, ""Fwd Packets/s"" DOUBLE, ""Bwd Packets/s"" DOUBLE, ""Min Packet Length"" BIGINT, ""Max Packet Length"" BIGINT, ""Packet Length Mean"" DOUBLE, ""Packet Length Std"" DOUBLE, ""Packet Length Variance"" DOUBLE, ""FIN Flag Count"" BIGINT, ""SYN Flag Count"" BIGINT, ""RST Flag Count"" BIGINT, ""PSH Flag Count"" BIGINT, ""ACK Flag Count"" BIGINT, ""URG Flag Count"" BIGINT, ""CWE Flag Count"" BIGINT, ""ECE Flag Count"" BIGINT, ""Down/Up Ratio"" BIGINT, ""Average Packet"" Size DOUBLE, ""Avg Fwd Segment Size"" DOUBLE, ""Avg Bwd Segment Size"" DOUBLE, ""Fwd Header Length_1"" BIGINT, ""Fwd Avg Bytes/Bulk"" BIGINT, ""Fwd Avg Packets/Bulk"" BIGINT, ""Fwd Avg Bulk Rate"" BIGINT, ""Bwd Avg Bytes/Bulk"" BIGINT, ""Bwd Avg Packets/Bulk"" BIGINT, ""Bwd Avg Bulk Rate"" BIGINT, ""Subflow Fwd Packets"" BIGINT, ""Subflow Fwd Bytes"" BIGINT, ""Subflow Bwd Packets"" BIGINT, ""Subflow Bwd Bytes"" BIGINT, Init_Win_bytes_forward BIGINT, Init_Win_bytes_backward BIGINT, act_data_pkt_fwd BIGINT, min_seg_size_forward BIGINT, ""Active Mean"" DOUBLE, ""Active Std"" DOUBLE, ""Active Max"" BIGINT, ""Active Min"" BIGINT, ""Idle Mean"" DOUBLE, ""Idle Std"" DOUBLE, ""Idle Max"" BIGINT, ""Idle Min"" BIGINT)",label,128027,3117165
Find all rows that show signs of DoS Hulk,DoS Hulk,"A DoS Hulk attack is an HTTP-based denial-of-service attack generated by the “HULK” tool, which overwhelms a web server by sending a massive number of HTTP GET requests while constantly randomizing elements like the URL query string, User-Agent, and referrer to evade caching and simple filtering. Instead of relying on huge bandwidth alone, it tries to keep the server busy processing each unique-looking request so it can’t handle real users. Common signs of a Hulk-style attack include a sudden, very large spike in HTTP requests to ports 80/443 from one or a small cluster of IPs, logs full of requests to the same path with endlessly changing query parameters, randomized or nonsense User-Agent and referrer headers, rapidly increasing server CPU and memory usage, a high number of concurrent connections in “processing” states, and users experiencing slow responses or frequent 5xx errors (like 503 Service Unavailable) even though the underlying network links may not appear saturated.","CREATE TABLE ids2017 (""Flow ID"" VARCHAR, ""Source IP"" VARCHAR, ""Source Port"" BIGINT, ""Destination IP"" VARCHAR, ""Destination Port"" BIGINT, Protocol BIGINT, Timestamp VARCHAR, ""Flow Duration"" BIGINT, ""Total Fwd Packets"" BIGINT, ""Total Backward Packets"" BIGINT, ""Total Length of Fwd Packets"" BIGINT, ""Total Length of Bwd Packets"" BIGINT, ""Fwd Packet Length Max"" BIGINT, ""Fwd Packet Length Min"" BIGINT, ""Fwd Packet Length Mean"" DOUBLE, ""Fwd Packet Length Std"" DOUBLE, ""Bwd Packet Length Max"" BIGINT, ""Bwd Packet Length Min"" BIGINT, ""Bwd Packet Length Mean"" DOUBLE, ""Bwd Packet Length Std"" DOUBLE, ""Flow Bytes/s"" DOUBLE, ""Flow Packets/s"" DOUBLE, ""Flow IAT Mean"" DOUBLE, ""Flow IAT Std"" DOUBLE, ""Flow IAT Max"" BIGINT, ""Flow IAT Min"" BIGINT, ""Fwd IAT Total"" BIGINT, ""Fwd IAT Mean"" DOUBLE, ""Fwd IAT Std"" DOUBLE, ""Fwd IAT Max"" BIGINT, ""Fwd IAT Min"" BIGINT, ""Bwd IAT Total"" BIGINT, ""Bwd IAT Mean"" DOUBLE, ""Bwd IAT Std"" DOUBLE, ""Bwd IAT Max"" BIGINT, ""Bwd IAT Min"" BIGINT, ""Fwd PSH Flags"" BIGINT, ""Bwd PSH Flags"" BIGINT, ""Fwd URG Flags"" BIGINT, ""Bwd URG Flags"" BIGINT, ""Fwd Header Length"" BIGINT, ""Bwd Header Length"" BIGINT, ""Fwd Packets/s"" DOUBLE, ""Bwd Packets/s"" DOUBLE, ""Min Packet Length"" BIGINT, ""Max Packet Length"" BIGINT, ""Packet Length Mean"" DOUBLE, ""Packet Length Std"" DOUBLE, ""Packet Length Variance"" DOUBLE, ""FIN Flag Count"" BIGINT, ""SYN Flag Count"" BIGINT, ""RST Flag Count"" BIGINT, ""PSH Flag Count"" BIGINT, ""ACK Flag Count"" BIGINT, ""URG Flag Count"" BIGINT, ""CWE Flag Count"" BIGINT, ""ECE Flag Count"" BIGINT, ""Down/Up Ratio"" BIGINT, ""Average Packet"" Size DOUBLE, ""Avg Fwd Segment Size"" DOUBLE, ""Avg Bwd Segment Size"" DOUBLE, ""Fwd Header Length_1"" BIGINT, ""Fwd Avg Bytes/Bulk"" BIGINT, ""Fwd Avg Packets/Bulk"" BIGINT, ""Fwd Avg Bulk Rate"" BIGINT, ""Bwd Avg Bytes/Bulk"" BIGINT, ""Bwd Avg Packets/Bulk"" BIGINT, ""Bwd Avg Bulk Rate"" BIGINT, ""Subflow Fwd Packets"" BIGINT, ""Subflow Fwd Bytes"" BIGINT, ""Subflow Bwd Packets"" BIGINT, ""Subflow Bwd Bytes"" BIGINT, Init_Win_bytes_forward BIGINT, Init_Win_bytes_backward BIGINT, act_data_pkt_fwd BIGINT, min_seg_size_forward BIGINT, ""Active Mean"" DOUBLE, ""Active Std"" DOUBLE, ""Active Max"" BIGINT, ""Active Min"" BIGINT, ""Idle Mean"" DOUBLE, ""Idle Std"" DOUBLE, ""Idle Max"" BIGINT, ""Idle Min"" BIGINT)",label,231073,3117165
Find all rows that show signs of Fuzzers,Fuzzers,"A fuzzer attack, or fuzzing, is a technique used to discover vulnerabilities in software. It involves sending unexpected or random input data to an application to see how it responds. Overwhelming the application with varied inputs can identify weaknesses or flaws. Fuzzing is an automated process using specialized tools called fuzzers. When a vulnerability is found, attackers can further analyze it and potentially exploit it.","CREATE TABLE unsw_nb15 (srcip VARCHAR, sport VARCHAR, dstip VARCHAR, dsport VARCHAR, proto VARCHAR, state VARCHAR, dur DOUBLE, sbytes BIGINT, dbytes BIGINT, sttl BIGINT, dttl BIGINT, sloss BIGINT, dloss BIGINT, service VARCHAR, Sload DOUBLE, Dload DOUBLE, Spkts BIGINT, Dpkts BIGINT, swin BIGINT, dwin BIGINT, stcpb BIGINT, dtcpb BIGINT, smeansz BIGINT, dmeansz BIGINT, trans_depth BIGINT, res_bdy_len BIGINT, Sjit DOUBLE, Djit DOUBLE, Stime BIGINT, Ltime BIGINT, Sintpkt DOUBLE, Dintpkt DOUBLE, tcprtt DOUBLE, synack DOUBLE, ackdat DOUBLE, is_sm_ips_ports BIGINT, ct_state_ttl BIGINT, ct_flw_http_mthd DOUBLE, is_ftp_login DOUBLE, ct_ftp_cmd VARCHAR, ct_srv_src BIGINT, ct_srv_dst BIGINT, ct_dst_ltm BIGINT, ct_src_ltm BIGINT, ct_src_dport_ltm BIGINT, ct_dst_sport_ltm BIGINT, ct_dst_src_ltm BIGINT)",attack_cat,20499,2280090
Find all rows that show signs of Reconnaissance,Reconnaissance,"This attack, also known as information gathering or footprinting, is a cyber attack that focuses on gathering valuable intelligence and information about a target system or network. The main objective of a reconnaissance attack is to gain a deeper understanding of the target's infrastructure, vulnerabilities, and potential entry points without directly causing any damage.","CREATE TABLE unsw_nb15 (srcip VARCHAR, sport VARCHAR, dstip VARCHAR, dsport VARCHAR, proto VARCHAR, state VARCHAR, dur DOUBLE, sbytes BIGINT, dbytes BIGINT, sttl BIGINT, dttl BIGINT, sloss BIGINT, dloss BIGINT, service VARCHAR, Sload DOUBLE, Dload DOUBLE, Spkts BIGINT, Dpkts BIGINT, swin BIGINT, dwin BIGINT, stcpb BIGINT, dtcpb BIGINT, smeansz BIGINT, dmeansz BIGINT, trans_depth BIGINT, res_bdy_len BIGINT, Sjit DOUBLE, Djit DOUBLE, Stime BIGINT, Ltime BIGINT, Sintpkt DOUBLE, Dintpkt DOUBLE, tcprtt DOUBLE, synack DOUBLE, ackdat DOUBLE, is_sm_ips_ports BIGINT, ct_state_ttl BIGINT, ct_flw_http_mthd DOUBLE, is_ftp_login DOUBLE, ct_ftp_cmd VARCHAR, ct_srv_src BIGINT, ct_srv_dst BIGINT, ct_dst_ltm BIGINT, ct_src_ltm BIGINT, ct_src_dport_ltm BIGINT, ct_dst_sport_ltm BIGINT, ct_dst_src_ltm BIGINT)",attack_cat,11935,2280090
Find all rows that show signs of Shellcode,Shellcode,"The term shellcode refers to a small piece of code that is injected into a vulnerable program, typically to gain unauthorized access and control over the system. The attacker first identifies a vulnerability in the target software, such as a buffer overflow or a code injection flaw. They then craft a payload, usually written in assembly language or machine code and designed to perform specific actions once executed. This payload is the shellcode.","CREATE TABLE unsw_nb15 (srcip VARCHAR, sport VARCHAR, dstip VARCHAR, dsport VARCHAR, proto VARCHAR, state VARCHAR, dur DOUBLE, sbytes BIGINT, dbytes BIGINT, sttl BIGINT, dttl BIGINT, sloss BIGINT, dloss BIGINT, service VARCHAR, Sload DOUBLE, Dload DOUBLE, Spkts BIGINT, Dpkts BIGINT, swin BIGINT, dwin BIGINT, stcpb BIGINT, dtcpb BIGINT, smeansz BIGINT, dmeansz BIGINT, trans_depth BIGINT, res_bdy_len BIGINT, Sjit DOUBLE, Djit DOUBLE, Stime BIGINT, Ltime BIGINT, Sintpkt DOUBLE, Dintpkt DOUBLE, tcprtt DOUBLE, synack DOUBLE, ackdat DOUBLE, is_sm_ips_ports BIGINT, ct_state_ttl BIGINT, ct_flw_http_mthd DOUBLE, is_ftp_login DOUBLE, ct_ftp_cmd VARCHAR, ct_srv_src BIGINT, ct_srv_dst BIGINT, ct_dst_ltm BIGINT, ct_src_ltm BIGINT, ct_src_dport_ltm BIGINT, ct_dst_sport_ltm BIGINT, ct_dst_src_ltm BIGINT)",attack_cat,1289,2280090
Find all rows that show signs of Analysis,Analysis,"This attack is a method where attackers gather and study information to exploit vulnerabilities in a system. This attack involves techniques such as traffic analysis, cryptographic analysis, code analysis, data analysis, and protocol analysis. Attackers use these techniques to gain insights, extract sensitive data, or identify weaknesses that can be exploited for malicious purposes.","CREATE TABLE unsw_nb15 (srcip VARCHAR, sport VARCHAR, dstip VARCHAR, dsport VARCHAR, proto VARCHAR, state VARCHAR, dur DOUBLE, sbytes BIGINT, dbytes BIGINT, sttl BIGINT, dttl BIGINT, sloss BIGINT, dloss BIGINT, service VARCHAR, Sload DOUBLE, Dload DOUBLE, Spkts BIGINT, Dpkts BIGINT, swin BIGINT, dwin BIGINT, stcpb BIGINT, dtcpb BIGINT, smeansz BIGINT, dmeansz BIGINT, trans_depth BIGINT, res_bdy_len BIGINT, Sjit DOUBLE, Djit DOUBLE, Stime BIGINT, Ltime BIGINT, Sintpkt DOUBLE, Dintpkt DOUBLE, tcprtt DOUBLE, synack DOUBLE, ackdat DOUBLE, is_sm_ips_ports BIGINT, ct_state_ttl BIGINT, ct_flw_http_mthd DOUBLE, is_ftp_login DOUBLE, ct_ftp_cmd VARCHAR, ct_srv_src BIGINT, ct_srv_dst BIGINT, ct_dst_ltm BIGINT, ct_src_ltm BIGINT, ct_src_dport_ltm BIGINT, ct_dst_sport_ltm BIGINT, ct_dst_src_ltm BIGINT)",attack_cat,2474,2280090
Find all rows that show signs of Backdoor,Backdoor,"A backdoor attack is a cybersecurity threat where unauthorized access is gained to a computer system or network by exploiting hidden vulnerabilities or intentionally creating openings. It involves the insertion of malicious code or modifications to existing code within a system, allowing attackers to bypass standard security measures and gain control over the targeted system to perform various malicious activities, such as stealing sensitive data, installing additional malware, or launching further attacks on the system or network.","CREATE TABLE unsw_nb15 (srcip VARCHAR, sport VARCHAR, dstip VARCHAR, dsport VARCHAR, proto VARCHAR, state VARCHAR, dur DOUBLE, sbytes BIGINT, dbytes BIGINT, sttl BIGINT, dttl BIGINT, sloss BIGINT, dloss BIGINT, service VARCHAR, Sload DOUBLE, Dload DOUBLE, Spkts BIGINT, Dpkts BIGINT, swin BIGINT, dwin BIGINT, stcpb BIGINT, dtcpb BIGINT, smeansz BIGINT, dmeansz BIGINT, trans_depth BIGINT, res_bdy_len BIGINT, Sjit DOUBLE, Djit DOUBLE, Stime BIGINT, Ltime BIGINT, Sintpkt DOUBLE, Dintpkt DOUBLE, tcprtt DOUBLE, synack DOUBLE, ackdat DOUBLE, is_sm_ips_ports BIGINT, ct_state_ttl BIGINT, ct_flw_http_mthd DOUBLE, is_ftp_login DOUBLE, ct_ftp_cmd VARCHAR, ct_srv_src BIGINT, ct_srv_dst BIGINT, ct_dst_ltm BIGINT, ct_src_ltm BIGINT, ct_src_dport_ltm BIGINT, ct_dst_sport_ltm BIGINT, ct_dst_src_ltm BIGINT)",attack_cat,2236,2280090
Find all rows that show signs of DoS,DoS,"A DoS (Denial of Service) attack is when an attacker tries to make a system, website, or network service unavailable to legitimate users by overwhelming it with traffic or resource-consuming requests, so it can’t respond properly anymore. Instead of sneaking in, the attacker’s goal is to disrupt availability—by exhausting bandwidth, CPU, memory, or connection slots. Common signs of a DoS attack include sudden and sustained spikes in traffic, services becoming very slow or completely unresponsive, unusually high numbers of connections or requests from one IP or a small set of IPs, error messages like “service unavailable” or timeouts for normal users, and network or system monitoring tools showing resource exhaustion (maxed-out CPU, bandwidth, or connection tables) without a legitimate reason such as a planned marketing event or expected traffic surge.","CREATE TABLE unsw_nb15 (srcip VARCHAR, sport VARCHAR, dstip VARCHAR, dsport VARCHAR, proto VARCHAR, state VARCHAR, dur DOUBLE, sbytes BIGINT, dbytes BIGINT, sttl BIGINT, dttl BIGINT, sloss BIGINT, dloss BIGINT, service VARCHAR, Sload DOUBLE, Dload DOUBLE, Spkts BIGINT, Dpkts BIGINT, swin BIGINT, dwin BIGINT, stcpb BIGINT, dtcpb BIGINT, smeansz BIGINT, dmeansz BIGINT, trans_depth BIGINT, res_bdy_len BIGINT, Sjit DOUBLE, Djit DOUBLE, Stime BIGINT, Ltime BIGINT, Sintpkt DOUBLE, Dintpkt DOUBLE, tcprtt DOUBLE, synack DOUBLE, ackdat DOUBLE, is_sm_ips_ports BIGINT, ct_state_ttl BIGINT, ct_flw_http_mthd DOUBLE, is_ftp_login DOUBLE, ct_ftp_cmd VARCHAR, ct_srv_src BIGINT, ct_srv_dst BIGINT, ct_dst_ltm BIGINT, ct_src_ltm BIGINT, ct_src_dport_ltm BIGINT, ct_dst_sport_ltm BIGINT, ct_dst_src_ltm BIGINT)",attack_cat,15618,2280090
Find all rows that show signs of Exploits,Exploits,"An exploit attack refers to exploiting computer systems or software vulnerabilities to gain unauthorized access or perform malicious activities. Exploits take advantage of weaknesses or flaws in a system's design or implementation, allowing attackers to execute specific commands or actions not intended by the system's developers. These vulnerabilities can exist in various components, such as operating systems, applications, or network protocols.","CREATE TABLE unsw_nb15 (srcip VARCHAR, sport VARCHAR, dstip VARCHAR, dsport VARCHAR, proto VARCHAR, state VARCHAR, dur DOUBLE, sbytes BIGINT, dbytes BIGINT, sttl BIGINT, dttl BIGINT, sloss BIGINT, dloss BIGINT, service VARCHAR, Sload DOUBLE, Dload DOUBLE, Spkts BIGINT, Dpkts BIGINT, swin BIGINT, dwin BIGINT, stcpb BIGINT, dtcpb BIGINT, smeansz BIGINT, dmeansz BIGINT, trans_depth BIGINT, res_bdy_len BIGINT, Sjit DOUBLE, Djit DOUBLE, Stime BIGINT, Ltime BIGINT, Sintpkt DOUBLE, Dintpkt DOUBLE, tcprtt DOUBLE, synack DOUBLE, ackdat DOUBLE, is_sm_ips_ports BIGINT, ct_state_ttl BIGINT, ct_flw_http_mthd DOUBLE, is_ftp_login DOUBLE, ct_ftp_cmd VARCHAR, ct_srv_src BIGINT, ct_srv_dst BIGINT, ct_dst_ltm BIGINT, ct_src_ltm BIGINT, ct_src_dport_ltm BIGINT, ct_dst_sport_ltm BIGINT, ct_dst_src_ltm BIGINT)",attack_cat,39390,2280090
Find all rows that show signs of Generic,Generic,"It is a kind of attack against the cryptography systems, which can run against all block-ciphers independently of their structure.","CREATE TABLE unsw_nb15 (srcip VARCHAR, sport VARCHAR, dstip VARCHAR, dsport VARCHAR, proto VARCHAR, state VARCHAR, dur DOUBLE, sbytes BIGINT, dbytes BIGINT, sttl BIGINT, dttl BIGINT, sloss BIGINT, dloss BIGINT, service VARCHAR, Sload DOUBLE, Dload DOUBLE, Spkts BIGINT, Dpkts BIGINT, swin BIGINT, dwin BIGINT, stcpb BIGINT, dtcpb BIGINT, smeansz BIGINT, dmeansz BIGINT, trans_depth BIGINT, res_bdy_len BIGINT, Sjit DOUBLE, Djit DOUBLE, Stime BIGINT, Ltime BIGINT, Sintpkt DOUBLE, Dintpkt DOUBLE, tcprtt DOUBLE, synack DOUBLE, ackdat DOUBLE, is_sm_ips_ports BIGINT, ct_state_ttl BIGINT, ct_flw_http_mthd DOUBLE, is_ftp_login DOUBLE, ct_ftp_cmd VARCHAR, ct_srv_src BIGINT, ct_srv_dst BIGINT, ct_dst_ltm BIGINT, ct_src_ltm BIGINT, ct_src_dport_ltm BIGINT, ct_dst_sport_ltm BIGINT, ct_dst_src_ltm BIGINT)",attack_cat,159161,2280090
Find all rows that show signs of Worms,Worms,"This malicious cyber-attack spreads through computer networks, targeting vulnerable systems and exploiting security vulnerabilities. Unlike viruses or Trojans, worms do not require user interaction to propagate. They can independently replicate and spread across a network, infecting multiple computers and devices.","CREATE TABLE unsw_nb15 (srcip VARCHAR, sport VARCHAR, dstip VARCHAR, dsport VARCHAR, proto VARCHAR, state VARCHAR, dur DOUBLE, sbytes BIGINT, dbytes BIGINT, sttl BIGINT, dttl BIGINT, sloss BIGINT, dloss BIGINT, service VARCHAR, Sload DOUBLE, Dload DOUBLE, Spkts BIGINT, Dpkts BIGINT, swin BIGINT, dwin BIGINT, stcpb BIGINT, dtcpb BIGINT, smeansz BIGINT, dmeansz BIGINT, trans_depth BIGINT, res_bdy_len BIGINT, Sjit DOUBLE, Djit DOUBLE, Stime BIGINT, Ltime BIGINT, Sintpkt DOUBLE, Dintpkt DOUBLE, tcprtt DOUBLE, synack DOUBLE, ackdat DOUBLE, is_sm_ips_ports BIGINT, ct_state_ttl BIGINT, ct_flw_http_mthd DOUBLE, is_ftp_login DOUBLE, ct_ftp_cmd VARCHAR, ct_srv_src BIGINT, ct_srv_dst BIGINT, ct_dst_ltm BIGINT, ct_src_ltm BIGINT, ct_src_dport_ltm BIGINT, ct_dst_sport_ltm BIGINT, ct_dst_src_ltm BIGINT)",attack_cat,150,2280090